{
  "contract": "D05-REPORT-DRAFT-1",
  "report_id": "GOLDEN-D05-CONDITIONAL-PREPARATION",
  "report_type": "decision_memo",
  "object_ref": "synthetic-consumer-product@v2",
  "scope_ref": "US-marketplace@2026-08-10",
  "as_of_time": "2026-08-10T00:00:00+08:00",
  "gate_status": "continue_with_conditions",
  "action_ceiling": "reversible_preparation",
  "evidence": ["synthetic:current-object-matched-screening"],
  "counterevidence": ["synthetic:professional-opinion-pending"],
  "alternatives": ["pause", "continue reversible preparation", "remove disputed claim"],
  "redlines": [],
  "gaps": ["qualified review of disputed claim"],
  "professional_reviews": ["qualified claim review"],
  "allowed_actions": ["internal draft", "reversible packaging mockup"],
  "blocked_actions": ["publish claim", "sell", "external submission"],
  "success_conditions": ["qualified review accepts exact claim and scope"],
  "stop_conditions": ["claim scope expands", "evidence expires", "review rejects claim"],
  "rollback": ["remove draft claim", "restore last accepted object version"],
  "expires_at": "2026-08-17T00:00:00+08:00",
  "lineage": {"input_hash": "3111111111111111111111111111111111111111111111111111111111111111", "report_hash": "4111111111111111111111111111111111111111111111111111111111111111"},
  "external_write": false,
  "maturity": "controlled pilot"
}
