{
  "contract": "D05-REPORT-DRAFT-1",
  "report_id": "GOLDEN-D05-EVIDENCE-REQUIRED",
  "report_type": "decision_card",
  "object_ref": "synthetic-regulated-product@v3",
  "scope_ref": "EU-marketplace@2026-08-10",
  "as_of_time": "2026-08-10T00:00:00+08:00",
  "gate_status": "evidence_required",
  "action_ceiling": "collect_evidence",
  "evidence": ["synthetic:manufacturer-declaration"],
  "counterevidence": ["synthetic:missing-current-test-report"],
  "alternatives": ["do not act", "obtain current scoped report", "redesign affected component"],
  "redlines": [],
  "gaps": ["current report matching model, factory and standard version"],
  "professional_reviews": ["qualified conformity assessment"],
  "allowed_actions": ["collect evidence", "prepare internal dossier"],
  "blocked_actions": ["launch", "claim conformity", "external filing"],
  "success_conditions": ["qualified evidence matches object, scope, time and use"],
  "stop_conditions": ["scope mismatch persists", "new safety counterevidence"],
  "rollback": ["retain evidence_required state", "invalidate dependent claims"],
  "expires_at": "2026-08-17T00:00:00+08:00",
  "lineage": {"input_hash": "1111111111111111111111111111111111111111111111111111111111111111", "report_hash": "2111111111111111111111111111111111111111111111111111111111111111"},
  "external_write": false,
  "maturity": "controlled pilot"
}
