{
  "contract":"D05-REPORT-DRAFT-1","report_id":"GOLDEN-D05-01","report_type":"decision_memo","object_ref":"synthetic-product@v1","scope_ref":"US-marketplace@2026-08-05","as_of_time":"2026-08-05T00:00:00+08:00","gate_status":"blocked","action_ceiling":"collect_evidence","evidence":["synthetic:E-safety"],"counterevidence":["synthetic:E-merchant-claim"],"alternatives":["do not act","obtain qualified review","redesign product"],"redlines":["major_safety_risk"],"gaps":["qualified safety evidence"],"professional_reviews":["qualified product safety review"],"allowed_actions":["collect evidence"],"blocked_actions":["launch","advertise","sell"],"success_conditions":["redline resolved by qualified evidence"],"stop_conditions":["redline persists","new incident"],"rollback":["retain prior blocked state","freeze dependent actions"],"expires_at":"2026-08-12T00:00:00+08:00","lineage":{"input_hash":"aaaaaaaaaaaaaaaaaaaaaaaaaaaaaaaaaaaaaaaaaaaaaaaaaaaaaaaaaaaaaaaa","report_hash":"bbbbbbbbbbbbbbbbbbbbbbbbbbbbbbbbbbbbbbbbbbbbbbbbbbbbbbbbbbbbbbbb"},"external_write":false,"maturity":"controlled pilot"
}
